{
    "chunk_id": 491287772150,
    "source_file": "Father_of_Stones.md",
    "content_type": "one and two",
    "h1_title": "Father of Stones",
    "h2_title": "How to Find Father of Stones",
    "h1_content": "Father of Stones is a Yaoguai Chief you'll fight soon after you reach the Heights of Ember in Chapter 5 of Black Myth: Wukong.",
    "h2_content": "From the Heights of Ember Keeper's Shrine, continue toward the open space on the left. When you reach a certain point, the Father of Stones miniboss will jump over the wall near the door on the right.",
    "promot": "This is an excerpt from the file 'Father_of_Stones.md', located in the main section titled 'Father of Stones'. The section summary is: Father of Stones is a Yaoguai Chief you'll fight soon after you reach the Heights of Ember in Chapter 5 of Black Myth: Wukong. This excerpt merges content from both the main and sub-sections. The sub-section is titled 'How to Find Father of Stones', and the detailed content is as follows:\nFrom the Heights of Ember Keeper's Shrine, continue toward the open space on the left. When you reach a certain point, the Father of Stones miniboss will jump over the wall near the door on the right.",
    "promot_tokens_num": 139
}